stock_name,stock_code,decision,current_price,avg_price,pnl_pct,price_source,checked_at,ai_sentiment,ai_confidence,ai_issue_summary,ai_positive_points,ai_risk_points,ai_price_context,ai_action_guide,ai_three_line_summary,ai_caution,gemini_model_used,ai_status,news_title_1,news_link_1,news_desc_1,news_title_2,news_link_2,news_desc_2,news_title_3,news_link_3,news_desc_3,news_title_4,news_link_4,news_desc_4,news_title_5,news_link_5,news_desc_5
금호타이어,073240,STOP_WATCH,4400.0,4865.0,-9.56,naver_finance,2026-06-09 01:51:39 KST,주의,보통,"금호타이어는 최근 해외 시장 공략을 위해 독일 '더 타이어 쾰른'에 참가하는 등 매출 증대 노력을 기울이고 있습니다. 또한, 100% 지분을 보유한 폴란드 종속회사 Kumho Tire Poland Sp. z o.o.의 유상증자를 결정하며 사업 확장을 모색하고 있습니다. 그러나 최근 주가는 하락세를 보이며 업종 평균과 유사한 흐름을 나타내고 있습니다. 외국인 투자자들의 소진율은 10% 내외로 파악되고 있으며, 최대 주주는 중국 더블스타의 자회사인 싱웨이코리아 주식회사입니다.","금호타이어는 해외 시장 공략을 통해 매출 증대를 꾀하고 있으며, 독일 '더 타이어 쾰른' 참가 등 적극적인 해외 마케팅 활동을 펼치고 있습니다. 또한, 폴란드 종속회사의 유상증자를 통해 사업 확장을 위한 기반을 다지고 있습니다. 이는 장기적인 성장 가능성을 보여주는 긍정적인 신호로 해석될 수 있습니다.","최근 금호타이어 주가는 하락세를 보이며 투자자들의 주의를 요하고 있습니다. 업종 평균과 유사한 등락률을 기록하고 있다는 점은 시장 전반의 약세 또는 해당 업종의 부진 가능성을 시사합니다. 또한, 최대 주주가 중국 기업이라는 점은 지정학적 리스크나 경영권 관련 이슈 발생 시 주가에 영향을 미칠 수 있는 요인으로 작용할 수 있습니다.","현재가 4,400원 대비 평균단가 4,865원으로 약 9.56%의 손실 구간에 있습니다. 최근 주가가 하락세를 보이며 평균단가 아래로 내려온 상황으로, 추가적인 하락 시 손실 폭이 확대될 수 있습니다. 업종 평균 등락률과 유사한 흐름을 보이고 있어 시장 상황에 따라 변동성이 나타날 수 있습니다.","현재 보유 중인 금호타이어는 평균단가 대비 손실 구간에 있으며, 최근 주가 하락세를 보이고 있습니다. 해외 시장 공략 등 긍정적인 사업 활동이 있으나, 업종 전반의 흐름과 시장 상황을 주시하며 신중한 대응이 필요합니다. 손실 폭 확대 가능성을 염두에 두고, 보유 비중 조절이나 추가적인 하락 시 대응 전략을 고려해 볼 수 있습니다. 다만, 현재 시점에서 확정적인 매수 또는 매도 추천은 어렵습니다.","1. 금호타이어는 해외 시장 공략 강화 및 종속회사 유상증자 등 사업 확장을 추진 중입니다.
2. 최근 주가는 하락세를 보이며 업종 평균과 유사한 흐름을 나타내고 있습니다.
3. 현재 보유자는 평균단가 대비 손실 구간에 있으며, 시장 상황을 고려한 신중한 대응이 요구됩니다.","본 정보는 투자 판단을 위한 보조 자료이며, 실제 투자 결정은 투자자 본인의 판단과 책임 하에 이루어져야 합니다. 뉴스 요약 및 분석은 제한된 정보를 기반으로 하며, 모든 잠재적 리스크를 포함하지 않을 수 있습니다.",gemini-2.5-flash-lite,gemini_ok,"통합특별시장 후보 릴레이 인터뷰: ③ 진보당 이종욱 ""민주당 견제 가능...",https://www.namdonews.com/news/articleView.html?idxno=911736,요즘 많은 분이 주식을 하십니다. 투자를 할 때 가장 중요한 원칙은 '성장 가능성'입니다. 미래가 없거나 곧... 광주지역본부장 -現 금호타이어 광주공장 정상화 시민대책위 공동대표 -現 진보당 광주광역시당 공동위원장...,"금호타이어 주가, 5월 19일 4,840원 2.42% 하락 마감",https://www.joongangenews.com/news/articleView.html?idxno=520403,"이는 업종 평균 대비 금호타이어의 이익 가치가 상대적으로 저평가되어 있음을 나타낸다. 외국인 투자자들의 움직임을 살펴보면, 상장주식수 대비 외국인 보유 주식수의 비율을 나타내는 외국인 소진율은 9....",[더벨]주요 공시(16:00~19:00),https://www.thebell.co.kr/free/content/ArticleView.asp?key=202605141844473120106163,"금호타이어, 유상증자 결정 금호타이어는 100% 지분을 보유한 종속회사 Kumho Tire Poland Sp. z o.o.가 약... 해당 종속회사는 폴란드 소재 타이어 제조·판매 법인. 새로 발행되는 주식은 보통주 289만1217주. 1주당...","금호타이어 주가, 5월 15일 5,060원 1.94% 하락 마감",https://www.joongangenews.com/news/articleView.html?idxno=519698,"외국인 투자자들의 금호타이어 주식 소진율은 10.10%로 파악되었다. 한편, 동일 업종의 등락률은 -2.05%를 기록하여 금호타이어의 하락폭과 유사한 흐름을 보였다. 지난 거래일 금호타이어는 5,160원으로 장을...","금호타이어, 매출 증대 위해 해외 공략…獨 더 타이어 쾰른 참가",https://www.koreareport.co.kr/news/articleView.html?idxno=50437,"두마리 토끼를 잡고, 세계적인 타이어 기업으로 도약하겠다""고 말했다. 한편, 금호타이어의 최대 주주가 중국 더블스타의 자회사인 싱웨이코리아 주식회사로, 금호타이어 지분 45%(1억2926만7129주)를 보유하고 있다."
대창솔루션,096350,STOP_WATCH,1898.0,2800.0,-32.21,naver_finance,2026-06-09 01:51:58 KST,주의,보통,"대창솔루션은 원전 관련주로 분류되며, 최근 미국-이란 휴전 가능성 및 국제 정세 변화에 따라 원전주 전반의 변동성이 나타나고 있습니다. 이러한 외부 요인으로 인해 두산에너빌리티, 우리기술 등과 함께 주가 흐름에 영향을 받고 있습니다. 다만, 2026년 1분기 별도 기준 매출액이 전년 동기 대비 107.79% 증가하는 등 긍정적인 실적 지표도 일부 확인되었습니다. 또한, 2025년까지 자사주 매입을 통한 기업가치 제고 계획도 발표되었습니다.","대창솔루션은 2026년 1분기 별도 기준 매출액이 전년 동기 대비 107.79% 증가하는 등 긍정적인 실적 성장세를 보였습니다. 또한, 2025년까지 총 주식 수의 약 5% 규모 자사주 매입을 시행하는 등 기업가치 제고 계획을 발표하여 주주 가치 증대에 대한 기대감을 높이고 있습니다. 원전 해체 시장 성장 가능성과 더불어 관련 기술력을 바탕으로 향후 사업 확장에 대한 잠재력을 가지고 있습니다.","원전 관련 테마주는 국제 정세 및 지정학적 리스크에 민감하게 반응하며 높은 변동성을 보일 수 있습니다. 최근 미국-이란 휴전 가능성 등 외부 요인으로 인해 원전주 전반의 주가 하락 압력을 받은 바 있습니다. 또한, 경쟁사 대비 기술력이나 시장 점유율 변화에 대한 지속적인 모니터링이 필요합니다. 현재 보유 중인 종목의 평균단가 대비 낮은 현재가는 추가적인 하락 위험에 대한 주의를 요합니다.",현재가 1898.0원은 평균단가 2800.0원 대비 약 32.21%의 손실 구간에 있습니다. 이는 현재 시장에서 해당 종목의 가치가 평균 매수 단가보다 낮게 평가되고 있음을 시사합니다. 최근 원전 관련주들의 전반적인 조정 흐름 속에서 대창솔루션 역시 약세를 보이며 손실 폭이 확대되었을 가능성이 있습니다.,"현재 보유 중인 대창솔루션은 평균단가 대비 상당한 손실 구간에 있으며, 원전 관련 테마주의 변동성을 고려할 때 신중한 접근이 필요합니다. 단기적인 주가 등락보다는 장기적인 관점에서 회사의 실적 개선 추이와 원전 산업의 성장 가능성을 면밀히 살펴보는 것이 중요합니다. 추가적인 하락 가능성에 대비하여 손절가 설정 등 리스크 관리 방안을 고려해 볼 수 있습니다. 회사의 자사주 매입 계획 등 주주 가치 제고 노력을 주시하며 향후 주가 흐름을 관망하는 전략을 추천합니다.","1. 대창솔루션은 원전 관련주로 국제 정세 변화에 따른 변동성이 높은 편입니다.
2. 긍정적인 매출 성장과 자사주 매입 계획이 있으나, 현재 주가는 평균단가 대비 큰 폭의 하락 상태입니다.
3. 원전 산업 성장 가능성을 장기적으로 보되, 단기 변동성에 유의하며 리스크 관리가 필요합니다.","본 정보는 투자 판단을 위한 참고 자료이며, 실제 투자 결정은 투자자 본인의 판단과 책임 하에 이루어져야 합니다. 제공된 정보는 시장 상황 및 기업 정보 변동에 따라 달라질 수 있습니다.",gemini-2.5-flash-lite,gemini_ok,두산에너빌리티·비에이치아이·우리기술 흔들렸지만…원전주 조정 속에...,https://www.cbci.co.kr/news/articleView.html?idxno=579720,"이밖에 한전기술은 12만5200원으로 3.77%, 일진파워는 3.37%, 우진엔텍은 3.36%, 대창솔루션은 3.49% 각각... 주식 투자에 따른 손실은 투자자 본인의 책임이며, 투자 결정 전 관련 공시와 기업 실적, 시장 상황을 충분히...","두산에너빌리티·우리기술·대창솔루션 흔들…원전주, 미국·이란 휴전...",https://www.cbci.co.kr/news/articleView.html?idxno=577428,"우리기술 역시 1만5820원 수준까지 내려오며 6%대 약세를 기록했고, 비에이치아이와 대창솔루션도 동반... 주식 및 원전 관련 테마주는 시장 상황과 국제 정세에 따라 높은 변동성을 나타낼 수 있으며, 투자에 따른 손실은...",5월 6일 주식시장 주요공시,https://www.catchnews.kr/news/articleView.html?idxno=123533,"59%) ▶대창솔루션, 2026년1분기 별도기준 매출액 145.37억원(전년동기대비 +107.79%), 영업이익 8.98억원... 2025년 기업가치 제고 계획 이행현황('25년까지 총 주식수의 약 5% 규모 자사주 매입 시행 등)...","우리기술·두산에너빌리티·오르비텍·대창솔루션, 원전해체주 혼조…수...",https://www.cbci.co.kr/news/articleView.html?idxno=571079,"반면 오르비텍은 1만1930원으로 0.75% 하락하며 약세를 보였고, 대창솔루션 역시 3055원으로 2.08% 밀리며 하락... [※ 본 기사는 AI의 도움을 받아 작성되었으며, 제공되는 정보는 일반적인 주식 및 금융시장 관련 소식...","오르비텍, 원전 해체 시장 선점 박차… R&D 분석센터로 기술 격차 벌린...",https://www.pinpointnews.co.kr/news/articleView.html?idxno=445720,15일 주식시장에서 원자력발전소 해체 테마는 노후 원전의 증가와 정부의 원전 산업 포트폴리오 다각화... 우리기술과 대창솔루션 역시 원전 제어 시스템 및 주강 부품 제조 역량을 바탕으로 오름세를 보이며 장을...
대한해운,005880,STOP_WATCH,1890.0,2519.0,-24.97,naver_finance,2026-06-09 01:52:16 KST,주의,보통,"대한해운은 최근 해운주 전반의 급락세 속에서 함께 하락하는 모습을 보였습니다. 이는 해상 운임 변동성과 관련된 시장 심리가 영향을 미친 것으로 분석됩니다. 또한, 매출 500대 기업에서 제외되었다는 소식도 있었으나, 이는 단기적인 주가 흐름에 큰 영향을 미치지는 않는 것으로 보입니다. 다만, 과거 HMM의 한진해운 자산 인수 입찰에서 SM그룹의 대한해운이 현대상선보다 높은 금액을 제시했던 사례가 언급되는 등, 그룹 차원의 움직임과 관련된 이슈가 존재합니다. 최근에는 벌크선 운임 회복 기대감과 장기 운송 계약의 안정성이 부각되며 주가가 상승하는 모습도 나타났습니다.","벌크선 운임 회복에 대한 기대감이 대한해운의 주가에 긍정적인 영향을 미칠 수 있습니다. 또한, 장기 운송 계약을 통한 안정적인 수익 구조는 회사의 펀더멘털에 긍정적인 요소로 작용할 수 있습니다. 과거 HMM의 자산 인수 과정에서 SM그룹의 대한해운이 적극적인 행보를 보였던 점은 그룹의 해운업에 대한 의지를 보여주는 부분입니다.","해운업 전반의 시황 변동성은 대한해운의 주가에 직접적인 영향을 미칠 수 있는 주요 리스크입니다. 최근 해운주들이 장중 급락하는 모습을 보인 것처럼, 해상 운임의 불안정성은 수익성에 부담을 줄 수 있습니다. 또한, 매출 500대 기업에서 제외되었다는 사실은 단기적으로 투자 심리에 부정적인 영향을 줄 가능성이 있습니다. 계열사를 통한 주식 담보 제공 이슈는 재무 건전성에 대한 잠재적 우려를 야기할 수 있습니다.","현재가 1890.0원 대비 평균단가 2519.0원은 약 24.97%의 손실 구간에 있음을 나타냅니다. 이는 현재 보유 중인 주식의 가치가 평균 매입 단가보다 낮게 형성되어 있음을 의미하며, 회복을 위해서는 현재가 이상의 상승이 필요한 상황입니다.","현재 보유 중인 대한해운 주식은 평균단가 대비 상당한 손실 구간에 있습니다. 최근 해운주 전반의 변동성과 함께 대한해운 역시 급락세를 경험했으나, 일부 긍정적인 뉴스도 나타나고 있어 주가 흐름을 면밀히 주시할 필요가 있습니다. 벌크선 운임 회복 기대감과 장기 계약의 안정성 등 긍정적인 요인과 해운 시황 변동성이라는 리스크 요인을 균형 있게 고려해야 합니다. 추가적인 하락 가능성과 반등 가능성을 모두 염두에 두고 신중한 대응 전략을 세우는 것이 중요합니다.","1. 대한해운은 해운주 전반의 급락세 속에서 함께 하락했으나, 벌크선 운임 회복 기대감으로 일부 상승세를 보이기도 했습니다.
2. 평균단가 대비 상당한 손실 구간에 있으며, 해운 시황 변동성과 재무 건전성에 대한 잠재적 우려가 리스크 요인으로 작용합니다.
3. 긍정적 요인과 리스크 요인을 종합적으로 고려하여 신중하게 대응할 필요가 있습니다.","본 정보는 투자 판단을 위한 보조 자료이며, 투자 결정에 대한 최종 책임은 투자자 본인에게 있습니다.",gemini-2.5-flash-lite,gemini_ok,HMM · 팬오션 등 해운주 '장중 급락'...해상운임은?,http://www.choicenews.co.kr/news/articleView.html?idxno=166259,"같은 시각 팬오션(-5.86%), 대한해운(-5.22%), KSS해운(-4.35%), 흥아해운(-3.33%) 등도 급락세로 움직이는 중이다.... 특정 섹터 및 특정 기업에 대한 분석 내용과 이슈, 특정 테마는 지켜봐야 하는 경우가 많은 데다, 주식투자...",[그래픽 뉴스] 매출 500대 기업 외,https://www.yonhapmidas.com/news/articleView.html?idxno=10367,"호반건설, 대한해운, 신세계푸드, 서희건설, 진에어, 유진기업 등은 500대 기업에서 제외됐다. 부동산 쏠림에 주식 자산효과 낮아 한국은행은 최근 발표한 '우리나라의 주식 자산효과에 대한 평가' 보고서에서...",우방의 이상한 자금조달…유일한 통로 계열사 주식 담보,http://www.wikileaks-kr.org/news/articleView.html?idxno=188163,"에스엠상선이 교보증권 등에 1094억원어치 대한해운 주식을 내준 것을 비롯해 에스엠스틸 227억원, 삼라 180억원, 동아건설산업 117억원 순이다. 에스엠상선을 뺀 나머지가 맡긴 담보에는 에스엠하이플러스 등 그룹내...",[HMM50년 돌아보기-55] 한진해운 자산 인수,http://www.thebigdata.co.kr/view.php?ud=202605270120529555570d99e4c8_23,"이 입찰에서는 현대상선이 유력한 후보로 예상되었지만, 더 높은 금액을 제시한 SM그룹의 대한해운이... 관련해 2017년 10월 현대상선은 100% 지분을 투자하여 특수목적법인 ‘에이치티알헤라시스주식회사(HT Algeciras Co....","""실적·성장 다 잡는다""… 주성코퍼레이션, 물류 훈풍 타고 매수 훈풍",https://www.pinpointnews.co.kr/news/articleView.html?idxno=454668,"주성코퍼레이션은 사업 영역 확장 계획이 구체화되면서 성장 잠재력이 부각됐고, 이는 곧바로 주식 시장 내... 대한해운은 3.05% 오른 2530원에 거래중이다. 벌크선 운임 회복 기대와 장기 운송 계약 안정성이 부각되며..."
에코플라스틱,038110,STOP_WATCH,2220.0,3750.0,-40.8,naver_finance,2026-06-09 01:52:34 KST,주의,보통,"에코플라스틱은 최근 '나프타 관련주'로 언급되며 주목받고 있으나, 이는 이재명 대통령의 '매점매석' 경고와 연관된 시장 흐름에 따른 것으로 보입니다. 또한, 자회사 ECOPLASTIC AMERICA Corp.에 대한 채무보증 결정 연장 공시가 있었습니다. 최근 주식 시장에서는 다양한 테마주가 부각되고 있으며, 에코플라스틱 역시 이러한 흐름 속에서 여러 뉴스에 간헐적으로 등장하고 있습니다. 다만, 이러한 뉴스들이 직접적인 주가 상승 동력으로 이어지고 있는지에 대한 명확한 신호는 아직 부족한 상황입니다.","에코플라스틱은 '나프타 관련주'로 언급되며 시장의 관심을 일부 받고 있습니다. 이는 원자재 가격 변동이나 지정학적 이슈에 따라 수혜를 볼 수 있는 잠재력을 시사합니다. 또한, 자회사에 대한 채무보증 결정은 사업 운영의 안정성을 위한 조치로 해석될 수 있습니다. 다만, 이러한 긍정적 요인들이 현재 주가에 충분히 반영되고 있는지는 추가적인 분석이 필요합니다.","현재 보유자의 손익률이 -40.8%로 상당한 손실 구간에 있다는 점이 가장 큰 리스크입니다. '나프타 관련주' 언급은 거시적 이슈에 따른 반짝 관심일 수 있으며, 실제 실적 개선으로 이어지지 않을 경우 주가 반등이 어려울 수 있습니다. 자회사 채무보증 연장 공시가 긍정적인 신호로 해석될 수도 있지만, 자회사의 재무 건전성이나 사업 리스크를 간접적으로 보여주는 것일 수도 있어 면밀한 검토가 필요합니다. 또한, 최근 뉴스에서 에코플라스틱이 다른 테마주들과 함께 언급되는 빈도가 높아, 특정 이슈에 대한 집중도가 낮을 수 있습니다.","현재가 2220.0원 대비 평균단가 3750.0원은 약 40.8%의 손실을 나타내고 있습니다. 이는 현재 보유 중인 주식의 가치가 상당 부분 하락했음을 의미하며, 손실 구간을 탈출하기 위해서는 현재가 대비 상당한 수준의 주가 상승이 필요함을 시사합니다. 현재 주가는 평균단가 대비 낮은 수준에 머물러 있어, 추가적인 하락보다는 반등에 대한 기대감이 있을 수 있으나, 현재까지의 추세로는 뚜렷한 반등 모멘텀이 보이지 않습니다.","현재 상당한 손실 구간에 있으므로, 추가적인 손실 확대를 방지하는 것이 중요합니다. '나프타 관련주' 등 단기적인 이슈에 따른 반등 가능성을 주시하되, 실질적인 주가 상승으로 이어지지 않을 경우 손절매를 고려하는 것도 전략이 될 수 있습니다. 자회사 채무보증 관련 공시 내용을 면밀히 검토하여 사업 리스크를 파악하고, 시장 전반의 흐름과 에코플라스틱의 개별적인 펀더멘털 변화를 지속적으로 관찰하는 것이 필요합니다. 보유 비중 조절을 통해 리스크 관리에 집중하는 것을 권장합니다.","1. '나프타 관련주'로 언급되며 시장의 관심을 일부 받고 있으나, 거시적 이슈에 따른 일시적 현상일 가능성도 있습니다.
2. 자회사 채무보증 연장 공시가 있었으며, 이는 사업 운영의 안정성 또는 잠재적 리스크 요인으로 해석될 수 있습니다.
3. 현재 보유자의 손익률이 -40.8%로 높아, 추가 손실 방지를 위한 신중한 대응과 시장 모니터링이 요구됩니다.","본 정보는 투자 판단을 위한 보조 자료이며, 실제 투자 결정은 투자자 본인의 판단과 책임 하에 이루어져야 합니다. 뉴스 요약 및 분석은 제공된 정보에 기반하며, 모든 잠재적 이슈를 포함하지 않을 수 있습니다.",gemini-2.5-flash-lite,gemini_ok,"""매점매석은 망하는 길"" 이재명 대통령 경고에 '나프타 관련주' 주목 [뉴...",http://www.newswell.co.kr/news/articleView.html?idxno=18565,"주식시장 7천피 열풍 속에 '나프타 관련주'가 주목받는 이유다. 이재명 대통령은 8일 'X'(옛 트위터)에 올린... 공급하는 ▲에코플라스틱(038110), 썩는 플라스틱인 PBAT(생분해성 폴리에스터)를 만드는 ▲SKC(011790) 등도...","에코플라스틱, 자회사 ECOPLASTIC AMERICA 채무보증 결정",https://www.digitaltoday.co.kr/news/articleView.html?idxno=661945,"ECOPLASTIC AMERICA Corp.는 2022년 12월 8일 설립된 주식회사로, 이번 공시는 2025년 5월 7일에 있었던 채무보증 결정 공시에 대한 연장계약에 따른 것이다. 에코플라스틱은 1984년 6월 1일 코스닥 시장에 상장된...",[주식마감] 트럼프 '휴전 연장' 선언에 중동 재건 기대감↑… 대원전선...,https://www.ggilbo.com/news/articleView.html?idxno=1154680,"기존 최대주주였던 임국강의 소유 주식 수는 2109만 주(증자 전 지분율 8.40%)였다. 지분 인수 목적은... 덕산하이메탈, 에코플라스틱, 노브랜드다. 이날 코스피는 전장보다 57.88포인트(0.90%) 오른 6,475.81에 장을...",[주식마감] '스페이스X' 상장 기대에 미래에셋벤투·아주IB 상한가... '광...,https://www.ggilbo.com/news/articleView.html?idxno=1152732,"주식마감 14일 성신양회, 주성코퍼레이션, 미래에셋벤처투자, 아주IB투자, 빛과전자, 퀄리타스반도체... 세림B&G, 에코플라스틱, 아주IB투자, 파워넷, 카티스, 위지트, 한국첨단소재, 애머릿지, 대신정보통신...","[자동차 밸류체인] [세코그룹] 지배력 키운 서진캠, 경영 승계 속도낼까",https://www.topdaily.kr/articles/109658,"서진오토모티브·에코플라스틱 자기주식 전량 그룹 내부서 소화 서진캠, 자회사 에스제이홀딩스 흡수 합병…지배구조 재편 움직임 세코(SECO)그룹의 경영승계 무게추는 ‘오너 3세’ 배기욱 서진캠 전무에 실려..."
