stock_name,stock_code,decision,current_price,avg_price,pnl_pct,price_source,checked_at,ai_sentiment,ai_confidence,ai_issue_summary,ai_positive_points,ai_risk_points,ai_price_context,ai_action_guide,ai_three_line_summary,ai_caution,gemini_model_used,ai_status,news_title_1,news_link_1,news_desc_1,news_title_2,news_link_2,news_desc_2,news_title_3,news_link_3,news_desc_3,news_title_4,news_link_4,news_desc_4,news_title_5,news_link_5,news_desc_5
태림포장,011280,STOP_WATCH,1825.0,2100.0,-13.1,naver_finance,2026-06-09 01:52:49 KST,주의,낮음,"현재 제공된 정보에는 태림포장에 대한 최근 뉴스가 없어, 기업의 현재 이슈 흐름을 파악하기 어렵습니다. 일반적으로 태림포장은 골판지 및 골판지 상자 제조를 주요 사업으로 영위하며, 이는 경기 변동 및 원자재 가격(폐지 등)에 영향을 받을 수 있습니다. 최근 특별한 시장의 주목을 받거나 부정적인 이슈가 없는 상태로 보입니다.","최근 특별한 긍정적 뉴스가 없는 상황입니다. 다만, 골판지 산업은 필수 소비재 포장에 사용되므로 일정 수준의 수요는 꾸준히 유지될 수 있습니다. 만약 원자재 가격이 안정되거나 하락한다면, 이는 기업의 수익성 개선에 긍정적인 영향을 미칠 수 있습니다. 현재로서는 외부 요인에 대한 기대감 외에 구체적인 긍정 요인을 찾기 어렵습니다.","가장 큰 리스크는 최근 기업 관련 뉴스가 없어 현재 시장의 관심도나 잠재적 변동성을 파악하기 어렵다는 점입니다. 또한, 골판지 산업은 경기 둔화 시 수요 감소와 원자재 가격 변동에 따른 마진 압박을 받을 수 있습니다. 현재 보유자의 평균단가 대비 손실 구간에 있어 추가 하락 시 심리적 부담이 커질 수 있습니다.","현재가 1,825원은 사용자 평균단가 2,100원 대비 약 -13.1%의 손실을 기록하고 있습니다. 이는 사용자가 매수한 이후 주가가 하락하여 현재 손실 구간에 있음을 의미합니다. 주가가 평균단가 아래에 머물러 있어, 추가적인 하락 가능성과 함께 본전 회복까지는 상당한 상승이 필요한 상황입니다.","현재 보유 종목에 대한 최신 뉴스가 없는 상황이므로, 기업의 공시나 사업보고서 등을 통해 최근 실적 및 사업 환경 변화를 면밀히 확인하는 것이 중요합니다. 골판지 산업의 전반적인 동향(원자재 가격, 경쟁 환경 등)을 지속적으로 모니터링하며 투자 판단의 근거를 보강해야 합니다. 현재 손실 구간이므로, 추가적인 하락 방지를 위한 손절가 설정 또는 반등 시나리오에 대한 전략 수립을 고려해 볼 수 있습니다. 개인의 투자 목표와 위험 감수 수준에 맞춰 신중하게 접근하시기 바랍니다.","1. 태림포장은 최근 뉴스가 없어 현재 기업의 이슈 파악이 어렵습니다.
2. 현재가는 평균단가 대비 -13.1% 손실 구간에 있어 주의가 필요합니다.
3. 기업 공시 및 산업 동향을 확인하며 신중한 대응 전략 수립이 권고됩니다.","본 정보는 투자 판단을 돕기 위한 보조 자료이며, 특정 종목의 매수 또는 매도를 권유하지 않습니다. 모든 투자 결정은 투자자 본인의 판단과 책임 하에 이루어져야 합니다.",gemini-2.5-flash,gemini_ok,,,,,,,,,,,,,,,
태웅,044490,STOP_WATCH,29200.0,40500.0,-27.9,naver_finance,2026-06-09 01:53:07 KST,주의,보통,"태웅은 최근 에너지 인프라 장비 관련 뉴스와 함께 언급되었으나, 해당 뉴스는 강원에너지의 호재와 함께 전력기기 업종 전반의 단기 속도 조절 가능성을 시사하고 있습니다. 여러 종목이 함께 언급되며 하락세를 보인다는 점에서 태웅 역시 이러한 시장 흐름의 영향을 받고 있을 가능성이 있습니다. 다만, 구체적으로 태웅 자체에 대한 긍정적 또는 부정적 이슈가 부각된 것은 아니며, 업종 전반의 분위기에 편승된 모습입니다.","태웅이 속한 에너지 인프라 장비 관련 업종의 장기 성장성은 여전히 유효하다는 증권가의 분석이 있습니다. 이는 향후 업황 개선 시 태웅에게도 긍정적인 영향을 줄 수 있는 잠재적 요인입니다. 또한, 최근 뉴스에서 태웅이 다른 에너지 관련 기업들과 함께 언급된 것은 해당 산업의 주목도를 반영하는 것으로 볼 수 있습니다.","최근 뉴스는 전력기기 업종 전반에 대해 단기 주가 속도 조절 가능성을 언급하고 있습니다. 이는 태웅 역시 이러한 시장의 단기적 조정 흐름에서 자유롭지 못할 수 있음을 시사합니다. 또한, 여러 종목이 함께 하락세를 보인다는 점은 개별 기업 이슈보다는 업종 전반의 투자 심리 위축 가능성을 나타낼 수 있습니다. 현재가와 평균단가 간의 큰 격차는 추가 하락 시 손실 폭 확대에 대한 우려를 높입니다.","현재가 29,200원 대비 평균단가 40,500원은 약 27.9%의 손실 구간에 있음을 나타냅니다. 이는 현재 보유하신 주가가 매수 시점보다 상당히 낮은 수준임을 의미하며, 손실을 만회하기 위해서는 상당한 주가 상승이 필요함을 시사합니다. 현재의 하락 추세가 지속될 경우 손실 폭이 더욱 확대될 수 있는 상황입니다.","현재 보유 중이신 태웅은 평균단가 대비 상당한 손실 구간에 있습니다. 최근 뉴스는 업종 전반의 단기 조정 가능성을 시사하고 있으므로, 추가적인 하락 가능성에 유의하며 신중한 접근이 필요합니다. 보유하신 종목의 향후 흐름을 면밀히 관찰하시고, 업종 및 개별 기업 관련 뉴스를 지속적으로 확인하며 대응 전략을 고민하시는 것이 좋겠습니다. 손실 구간이므로, 반등 시 비중 조절 또는 추가 매수 여부에 대한 신중한 판단이 요구됩니다.","1. 태웅은 에너지 인프라 장비 관련주로 분류되나, 최근 뉴스는 업종 전반의 단기 조정 가능성을 시사하고 있습니다.
2. 현재 보유하신 주가는 평균단가 대비 상당한 손실 구간에 있으며, 추가 하락 시 손실 확대 위험이 있습니다.
3. 업종 및 개별 기업의 향후 흐름을 면밀히 관찰하며 신중한 대응 전략을 수립하는 것이 중요합니다.","본 정보는 투자 판단을 위한 보조 자료이며, 실제 투자 결정은 투자자 본인의 판단과 책임 하에 이루어져야 합니다. 제공된 정보는 시장 상황 및 기업 정보의 변동에 따라 달라질 수 있습니다.",gemini-2.5-flash-lite,gemini_ok,쌍끌이 호재 터진 강원에너지 주가 휘파람…에너지 인프라 장비 수주 릴...,https://www.pinpointnews.co.kr/news/articleView.html?idxno=455885,"증권가에서는 전력기기 업종의 장기 성장성은 유효하지만 단기 주가 속도 조절 가능성을 거론하고 있다.... 대창솔루션과 티플랙스, 에이프로젠, 대우건설, SNT에너지, 태웅, 디케이락, 비에이치아이도 일제히 밀리고...",쌍끌이 호재 터진 강원에너지 주가 휘파람…에너지 인프라 장비 수주 릴...,https://www.pinpointnews.co.kr/news/articleView.html?idxno=455885,"시장에서는 실적 개선 기대는 여전히 유효하지만 단기 과열 해소 과정이 진행되고 있다는 분석이 나온다. LS... 대창솔루션과 티플랙스, 에이프로젠, 대우건설, SNT에너지, 태웅, 디케이락, 비에이치아이도 일제히 밀리고...",,,,,,,,,
HANARO K휴머노이드테마TOP10,0155N0,STOP_WATCH,9890.0,11000.0,-10.09,naver_finance,2026-06-09 01:53:18 KST,중립,낮음,HANARO K휴머노이드테마TOP10 ETF는 휴머노이드 관련 기업에 투자하는 상품입니다. 현재 관련 뉴스 피드가 없어 구체적인 시장 동향이나 개별 기업 이슈를 파악하기 어렵습니다. 따라서 ETF의 성과에 영향을 미칠 수 있는 외부 요인에 대한 정보가 부족한 상황입니다.,"휴머노이드 기술은 미래 성장 가능성이 높은 분야로 주목받고 있습니다. 관련 기술 발전 및 상용화가 가속화될 경우, 해당 테마 ETF는 장기적인 상승 잠재력을 가질 수 있습니다. 또한, 다양한 휴머노이드 관련 기업에 분산 투자함으로써 개별 기업 리스크를 완화할 수 있습니다.","휴머노이드 산업은 아직 초기 단계에 있어 기술 발전의 불확실성이 존재합니다. 또한, 관련 기업들의 실적 변동성이 클 수 있으며, 투자 심리 변화에 따라 급격한 가격 변동이 발생할 수 있습니다. 특정 기술이나 기업에 대한 의존도가 높아질 경우, 해당 부분의 문제 발생 시 ETF 전체에 부정적인 영향을 미칠 수 있습니다.","현재가 9890.0원으로 평균단가 11000.0원 대비 10.09%의 손실 구간에 있습니다. 이는 현재 시장에서 해당 ETF의 가치가 평균 매수 가격보다 낮게 평가되고 있음을 시사합니다. 다만, 이는 단기적인 가격 흐름일 수 있으며, 향후 시장 상황 및 테마 모멘텀에 따라 변동될 수 있습니다.","현재 보유 중이신 HANARO K휴머노이드테마TOP10 ETF는 손실 구간에 있습니다. 관련 뉴스가 없어 명확한 투자 판단 근거를 찾기 어렵습니다. 휴머노이드 산업의 장기적인 성장 가능성을 염두에 두고 투자하신다면, 추가적인 정보 탐색을 통해 시장 동향을 주시하는 것이 좋습니다. 단기적인 변동성에 대한 대응 전략을 고민해 볼 수도 있습니다. 손절가 설정 등 리스크 관리 방안을 고려해 보시는 것도 방법입니다.","1. 휴머노이드 테마 ETF로, 관련 뉴스 부재로 시장 동향 파악이 어렵습니다.
2. 미래 성장 가능성은 있으나, 초기 산업 단계로 기술 및 실적 불확실성이 존재합니다.
3. 현재 평균단가 대비 손실 구간이며, 장기적 관점 또는 리스크 관리 전략이 필요합니다.","본 정보는 투자 판단을 위한 보조 자료이며, 실제 투자 결정은 투자자 본인의 판단과 책임 하에 이루어져야 합니다. 제공된 정보는 시장 상황 변화에 따라 달라질 수 있습니다.",gemini-2.5-flash-lite,gemini_ok,,,,,,,,,,,,,,,
LG유플러스,032640,HOLD,15720.0,15400.0,2.08,naver_finance,2026-06-09 01:53:37 KST,중립,낮음,"현재 LG유플러스와 관련된 특정 뉴스가 제공되지 않았습니다. 따라서 최근 시장 동향이나 기업 관련 주요 이슈에 대한 정보가 부족하여 구체적인 이슈 요약을 제공하기 어렵습니다. 일반적으로 통신 업계는 5G 투자, 요금제 경쟁, 신규 서비스 출시 등 다양한 요인에 의해 영향을 받습니다. 이러한 거시적인 산업 환경 속에서 기업의 개별적인 움직임을 파악하는 것이 중요합니다.","LG유플러스는 국내 3대 통신사 중 하나로서 안정적인 가입자 기반을 보유하고 있습니다. 5G 네트워크 구축 및 서비스 확장을 통해 성장 동력을 확보하려는 노력을 지속하고 있습니다. 또한, 미디어, IoT, 클라우드 등 다양한 신사업 분야로의 확장을 통해 미래 성장 가능성을 모색하고 있습니다. 이러한 사업 다각화 노력은 장기적인 관점에서 긍정적인 요인이 될 수 있습니다.","통신 산업은 막대한 설비 투자 부담과 치열한 경쟁 환경에 놓여 있습니다. 정부의 통신비 인하 정책이나 규제 강화는 수익성에 부담으로 작용할 수 있습니다. 또한, 5G 투자 회수 기간 지연이나 신규 서비스의 시장 안착 실패는 재무적인 리스크로 이어질 수 있습니다. 경쟁사 대비 차별화된 서비스 제공 능력 부족은 시장 점유율 유지에 어려움을 줄 수 있습니다.","현재가 15,720원은 평균단가 15,400원 대비 소폭 상승한 상태로, 약 2.08%의 수익률을 기록하고 있습니다. 이는 현재까지는 긍정적인 흐름을 보여주고 있음을 시사합니다. 다만, 최근 관련 뉴스가 없어 추가적인 상승 또는 하락 동력을 파악하기는 어렵습니다. 현재 가격대는 이전 평균단가 대비 소폭의 이익 구간에 있으므로, 향후 시장 상황 및 기업 관련 뉴스에 따라 변동성이 나타날 수 있습니다.","현재 보유 중이신 LG유플러스 종목은 평균단가 대비 소폭의 수익 구간에 있습니다. 관련 뉴스가 없어 명확한 투자 방향을 제시하기는 어렵지만, 현재까지는 긍정적인 가격 흐름을 유지하고 있습니다. 향후 5G 투자 성과, 신규 사업 진행 상황, 경쟁사 동향 등을 면밀히 주시하며 대응하는 것이 좋겠습니다. 단기적인 시장 변동성에 일희일비하기보다는 장기적인 관점에서 기업의 펀더멘털 변화를 관찰하며 보유 여부를 결정하는 것을 고려해볼 수 있습니다.","1. LG유플러스는 5G 투자 및 신사업 확장을 통해 성장 동력을 모색하고 있으나, 통신 산업의 경쟁 심화 및 규제 리스크에 노출되어 있습니다.
2. 현재 주가는 평균단가 대비 소폭 상승한 상태로 긍정적인 흐름을 보이고 있으나, 관련 뉴스가 부족하여 추가적인 방향성 판단이 어렵습니다.
3. 향후 5G 투자 성과와 신규 사업의 시장 안착 여부를 주시하며 장기적인 관점에서 대응하는 것이 중요합니다.","본 분석은 제공된 정보와 일반적인 시장 상황을 바탕으로 작성되었으며, 투자 결정에 대한 최종적인 책임은 투자자 본인에게 있습니다. 특정 종목에 대한 투자 추천이나 확정적인 매수/매도 신호로 해석되어서는 안 됩니다. 투자 전 반드시 추가적인 정보 수집 및 전문가 상담을 통해 신중하게 판단하시기 바랍니다.",gemini-2.5-flash-lite,gemini_ok,,,,,,,,,,,,,,,
TIGER K방산&우주,463250,STOP_WATCH,35770.0,44500.0,-19.62,naver_finance,2026-06-09 01:53:54 KST,중립,낮음,"현재 보유하신 TIGER K방산&우주 ETF와 관련된 최근 뉴스가 확인되지 않았습니다. 따라서 현재 시장에서 특별히 주목받는 이슈나 뉴스는 없는 것으로 판단됩니다. 방산 및 우주 산업 전반에 대한 투자자들의 관심은 꾸준히 존재하지만, 해당 ETF 자체에 대한 구체적인 정보는 부족한 상황입니다. 향후 관련 산업 동향이나 정책 변화 등을 주시할 필요가 있습니다.","K방산 및 우주 산업은 장기적인 성장 잠재력을 가진 분야로 평가받고 있습니다. 정부의 적극적인 육성 정책과 수출 증가세는 긍정적인 요인으로 작용할 수 있습니다. 또한, 우주 탐사 및 개발에 대한 민간 기업들의 참여 확대는 관련 산업의 성장을 더욱 가속화시킬 수 있습니다.","방산 산업은 지정학적 리스크에 민감하게 반응할 수 있으며, 국제 정세 변화에 따라 수주 및 수출에 영향을 받을 수 있습니다. 우주 산업 역시 높은 초기 투자 비용과 기술 개발의 불확실성을 내포하고 있습니다. 또한, ETF의 경우 기초 자산의 변동성에 따라 수익률이 크게 달라질 수 있다는 점을 유의해야 합니다.","현재가 35,770원 대비 평균단가 44,500원으로 약 19.62%의 손실을 기록하고 있습니다. 이는 현재 보유하신 ETF의 가격이 평균 매수 가격보다 낮은 수준임을 의미합니다. 현재 시장 상황에서 뚜렷한 뉴스가 없는 만큼, 가격 반등을 위해서는 방산 및 우주 산업 전반의 긍정적인 모멘텀이 필요해 보입니다.","현재 보유하신 TIGER K방산&우주 ETF는 평균단가 대비 손실 구간에 있습니다. 관련 산업에 대한 장기적인 전망을 고려하여 보유를 지속할지 여부를 신중하게 판단하는 것이 좋습니다. 단기적인 가격 변동보다는 산업 전반의 성장 가능성과 거시 경제 지표를 함께 살펴보는 것이 중요합니다. 추가적인 매수나 매도 결정은 신중하게 접근하며, 손절가 설정 등 리스크 관리 방안을 고려해 볼 수 있습니다.","1. TIGER K방산&우주 ETF 관련 최신 뉴스가 없어 현재 뚜렷한 이슈는 부재합니다.
2. K방산 및 우주 산업은 장기 성장 잠재력이 있으나, 지정학적 리스크 및 높은 초기 투자 비용 등의 위험 요인이 존재합니다.
3. 현재 평균단가 대비 손실 구간이므로, 장기적 관점에서 산업 동향을 주시하며 신중한 대응이 필요합니다.","본 정보는 투자 판단을 위한 보조 자료이며, 실제 투자 결정은 투자자 본인의 판단과 책임 하에 이루어져야 합니다. 과거의 수익률이 미래의 수익률을 보장하지 않으며, 투자에는 원금 손실의 위험이 따릅니다.",gemini-2.5-flash-lite,gemini_ok,,,,,,,,,,,,,,,
컴퍼니케이,307930,STOP_WATCH,7950.0,9150.0,-13.11,naver_finance,2026-06-09 01:54:12 KST,중립,낮음,컴퍼니케이와 관련된 최근 뉴스 데이터가 제공되지 않았습니다. 따라서 현재 시장에서 주목받는 구체적인 이슈나 동향을 파악하기 어렵습니다. 회사의 사업 모델이나 최근 실적 발표 등 공개된 정보가 있다면 이를 바탕으로 추가적인 분석이 필요합니다. 현재로서는 외부 요인에 의한 주가 변동 가능성을 배제할 수 없습니다.,현재 제공된 정보만으로는 컴퍼니케이의 긍정적인 측면을 구체적으로 파악하기 어렵습니다. 회사의 투자 성과나 신규 사업 진출 등 긍정적인 모멘텀이 있다면 주가에 긍정적인 영향을 미칠 수 있습니다. 향후 발표될 실적이나 사업 보고서를 통해 긍정적인 요인을 탐색할 필요가 있습니다.,"관련 뉴스가 없어 현재 컴퍼니케이에 대한 구체적인 리스크 요인을 파악하기 어렵습니다. 하지만 투자 종목은 언제나 시장 변동성, 금리 변화, 경쟁 심화 등 다양한 거시적 및 미시적 리스크에 노출될 수 있습니다. 특히 정보 부족은 잠재적 리스크에 대한 대응을 어렵게 만들 수 있습니다.","현재가 7,950원 대비 평균단가 9,150원으로 약 13.11%의 손실 구간에 있습니다. 이는 현재 보유 중인 물량의 평균 매입 단가보다 주가가 하락한 상태임을 의미합니다. 현재가와 평균단가의 격차는 추가적인 하락 시 손실 폭이 확대될 수 있음을 시사합니다.","현재 컴퍼니케이 관련 뉴스가 없어 명확한 투자 판단 근거를 찾기 어렵습니다. 보유자 입장에서는 추가적인 정보 수집이 중요하며, 회사의 사업 내용과 재무 상태를 면밀히 검토하는 것이 필요합니다. 현재 손실 구간이므로, 향후 주가 움직임과 시장 상황을 주시하며 신중하게 대응하는 것이 권장됩니다. 손절가 설정 등 리스크 관리 방안을 고려해 볼 수 있습니다.","1. 컴퍼니케이 관련 최신 뉴스가 없어 현재 시장 이슈 파악이 어렵습니다.
2. 현재가 7,950원으로 평균단가 9,150원 대비 약 13.11% 손실 상태입니다.
3. 정보 부족으로 인해 신중한 관망 또는 리스크 관리 전략이 필요합니다.","본 분석은 제공된 제한적인 정보만을 기반으로 하며, 투자 결정에 대한 최종 책임은 투자자 본인에게 있습니다. 투자 전 반드시 추가적인 정보 탐색 및 전문가 상담을 통해 신중하게 판단하시기 바랍니다.",gemini-2.5-flash-lite,gemini_ok,,,,,,,,,,,,,,,
