category,query,title,description,link,pubDate,api_state,checked_at
news,코스피,코스피 'V자 반등' 성공…7% 넘게 급등해 8000 회복,코스피가 'V자 반등'에 성공하며 8000고지를 회복했다. 9일 코스피는 전 거래일보다 2.85% 오른 7697.76으로 출발해 상승폭을 키우며 장초반 '매수' 사이드카가 발동했다. 이후 차익실현 매물이 나타나면서 오름폭을...,https://n.news.naver.com/mnews/article/079/0004155863?sid=101,"Tue, 09 Jun 2026 14:35:00 +0900",ok,2026-06-09 14:36:37 KST
news,코스피,"국장 오르자 외인이 던진 이유…""싫어도 어쩔 수 없었다""","한때 9000에 근접했던 코스피(KOSPI) 지수가 폭락한 배경에는 외인의 대규모 매도가 있었다. 그러나 이같은... 매도했다""며 ""코스피의 '지나친 성공'이 오히려 매도 압력으로 작용""했다고 분석했다. 외인은 지난달 7일부터...",https://n.news.naver.com/mnews/article/277/0005773923?sid=101,"Tue, 09 Jun 2026 14:31:00 +0900",ok,2026-06-09 14:36:37 KST
news,코스피,'검은 월요일' 딛고 반등…코스피 '8천피' 회복,"코스피가 오늘(9일) 장중 7% 넘게 급등하며 8,000선을 되찾았습니다. 오늘 오후 1시 29분 기준 코스피는 전 거래일보다 533.26포인트(7.12%) 오른 8,017.67을 기록했습니다. 지수는 전장 대비 213.35포인트(2.85...",https://n.news.naver.com/mnews/article/057/0001952991?sid=101,"Tue, 09 Jun 2026 14:31:00 +0900",ok,2026-06-09 14:36:37 KST
news,코스피,[연합뉴스 이 시각 헤드라인] - 14:30,"■ 코스피, 장중 7% 넘게 급등해 '8천피' 회복 코스피가 9일 장중 7% 넘게 급등해 '8천피'(코스피 8,000포인트)를 되찾았다. 이날 오후 1시 29분 현재 코스피는 전장보다 533.26포인트(7.12%) 오른 8,017.67이다. 지수는...",https://n.news.naver.com/mnews/article/001/0016128423?sid=101,"Tue, 09 Jun 2026 14:30:00 +0900",ok,2026-06-09 14:36:37 KST
news,코스피,외인 매도에도 코스피 8000선 회복…SK하이닉스 10% 급등,"전날 8% 넘게 급락했던 코스피가 하루 만에 반등해 장중 8,000선을 회복했다. SK하이닉스는 210만원선을... ○ 하루 만에 낙폭 만회한 코스피 연합뉴스에 따르면 9일 오후 1시29분 기준 코스피는 전 거래일보다 533....",https://www.topstarnews.net/news/articleView.html?idxno=16084926,"Tue, 09 Jun 2026 14:30:00 +0900",ok,2026-06-09 14:36:37 KST
news,코스닥,코스피 'V자 반등' 성공…7% 넘게 급등해 8000 회복,장초반 매수 사이드카가 작동한 코스닥도 오후 들어 상승폭을 7%대로 키우며 976을 기록 중이다. 한편 '공포지수'로 불리는 코스피200변동성(VKOSPI) 지수가 사상 최고치를 경신하며 극단적인 변동성 장세를...,https://n.news.naver.com/mnews/article/079/0004155863?sid=101,"Tue, 09 Jun 2026 14:35:00 +0900",ok,2026-06-09 14:36:38 KST
news,코스닥,'검은 월요일' 딛고 반등…코스피 '8천피' 회복,"76으로 출발해 장 후반 상승폭을 키웠습니다. 장중 한때 8,021.91까지 뛰며, '검은 월요일'이었던 어제(8일) 낙폭(-8.29%)을 만회하는 모습입니다. 같은 시각 코스닥 지수는 62.39포인트(6.85%) 오른 973.78입니다.",https://n.news.naver.com/mnews/article/057/0001952991?sid=101,"Tue, 09 Jun 2026 14:31:00 +0900",ok,2026-06-09 14:36:38 KST
news,코스닥,외인 매도에도 코스피 8000선 회복…SK하이닉스 10% 급등,코스닥도 같은 시각 62.39포인트(6.85%) 상승한 973.78을 기록했다. 이날 상승세는 전날 급락 과정에서 크게 조정을 받았던 반도체와 대형 기술주 중심으로 나타났다. 시가총액 상위 종목들이 일제히 반등하면서 지수...,https://www.topstarnews.net/news/articleView.html?idxno=16084926,"Tue, 09 Jun 2026 14:30:00 +0900",ok,2026-06-09 14:36:38 KST
news,코스닥,급반등에 증시 '공포지수' 사상최대…금융위기 이후 최고,29%)을 만회 중이다. 같은 시각 코스닥 지수도 6.85% 올랐다. 이날 오전 유가증권시장과 코스닥 시장에선 장 초반 급반등이 나타나며 사이드카가 잇따라 발동되기도 했다.,http://www.newsfc.co.kr/news/articleView.html?idxno=79149,"Tue, 09 Jun 2026 14:22:00 +0900",ok,2026-06-09 14:36:38 KST
news,코스닥,[뉴스현장] 폭락장 딛고 급반등…개인 순매수 상승 주도,"국내 증시가 어제의 폭락장을 딛고 급반등함에 따라, 오늘은 코스피·코스닥 매수 사이드카가 동시 발동됐습니다. 22거래일 연속 팔자를 이어간 외국인과 달리, 개인은 순매수를 보이고 있는데요. 개미투자자들이 급락...",https://n.news.naver.com/mnews/article/422/0000872867?sid=101,"Tue, 09 Jun 2026 14:20:00 +0900",ok,2026-06-09 14:36:38 KST
news,국내증시,"국장 오르자 외인이 던진 이유…""싫어도 어쩔 수 없었다""","국내 증시가 급상승하면서 신흥 시장(이머징 마켓·EM) 벤치마크 지수의 한국 비중이 확대됐고, 이로 인해 포트폴리오 내 특정 국가나 종목 비중을 조절하느라 자연스럽게 매도 압력으로 작용했다는 것이다. 이를 두고...",https://n.news.naver.com/mnews/article/277/0005773923?sid=101,"Tue, 09 Jun 2026 14:31:00 +0900",ok,2026-06-09 14:36:39 KST
news,국내증시,외인 매도에도 코스피 8000선 회복…SK하이닉스 10% 급등,"○ 69조원 팔아도 ""한국 비관 신호 아니다"" 뉴시스에 따르면 외국인은 지난달 7일부터 전날까지 국내 증시에서 약 69조6,841억원을 순매도했다. 그러나 CNBC가 인용한 글로벌 투자업계 관계자들은 최근 매도세를 한국...",https://www.topstarnews.net/news/articleView.html?idxno=16084926,"Tue, 09 Jun 2026 14:30:00 +0900",ok,2026-06-09 14:36:39 KST
news,국내증시,[李정부 1년] “반도체 덕” 확장재정에 기댄 경기부양…성장·건전성 ...,"덩달아 국내 증시도 치솟았다. 올해 코스피 지수는 8000선을 돌파하며 사상 최고치를 새로 썼다. 이 대통령 취임 당시, 지난해 6월 코스피 지수가 3000선을 밑돌았던과 비교하면 엄청난 반등이다. 반도체 호황에 증시...",https://www.ekn.kr/web/view.php?key=20260609028021671,"Tue, 09 Jun 2026 14:28:00 +0900",ok,2026-06-09 14:36:39 KST
news,국내증시,현대해상 '금리 상승'·'실손 개편' 수혜 기대,"이어 ""향후 국내 증시가 인공지능(AI)과 반도체 중심의 성장주 장세로 재편될 경우 상대적인 투자 선호도가 낮아질 수 있다""고 덧붙였다. 한편, 지난 1월 28일 김지원 다올투자증권 연구원은 지난해 4분기 실적은 손해율...",https://www.consumuch.com/news/articleView.html?idxno=78267,"Tue, 09 Jun 2026 14:26:00 +0900",ok,2026-06-09 14:36:39 KST
news,국내증시,[뉴스현장] 폭락장 딛고 급반등…개인 순매수 상승 주도,"국내 증시가 어제의 폭락장을 딛고 급반등함에 따라, 오늘은 코스피·코스닥 매수 사이드카가 동시 발동됐습니다. 22거래일 연속 팔자를 이어간 외국인과 달리, 개인은 순매수를 보이고 있는데요. 개미투자자들이 급락...",https://n.news.naver.com/mnews/article/422/0000872867?sid=101,"Tue, 09 Jun 2026 14:20:00 +0900",ok,2026-06-09 14:36:39 KST
news,주식시장,"국장 오르자 외인이 던진 이유…""싫어도 어쩔 수 없었다""","8일(현지시간) 미국 CNBC는 ""사상 최고치를 경신한 한국 주식 시장에서 외국인들이 올해 수십억달러의 주식을 매도했다""며 ""코스피의 '지나친 성공'이 오히려 매도 압력으로 작용""했다고 분석했다. 외인은 지난달 7일부터...",https://n.news.naver.com/mnews/article/277/0005773923?sid=101,"Tue, 09 Jun 2026 14:31:00 +0900",ok,2026-06-09 14:36:40 KST
news,주식시장,"글로벌 패널사 가동률 폭발… 코세스, 플렉서블 장비 수주 모멘텀 본격...","글로벌 IT 세트 업체들의 폴더블(접이식), 롤러블(말이식)을 넘어선 슬라이더블 및 스트레처블(늘어나는) 디스플레이 채택 가속화와 고부가 패널 수요 증가 기대감이 맞물리면서, 국내 주식시장에서 플렉서블 디스플레이...",https://www.pinpointnews.co.kr/news/articleView.html?idxno=458733,"Tue, 09 Jun 2026 14:30:00 +0900",ok,2026-06-09 14:36:40 KST
news,주식시장,"급락 후 다시 뛴 美 반도체주...월가 ""건전한 조정""","한동안 랠리를 펼치며 주식시장을 이끌던 반도체 주식은 미국과 이란의 종전 협상을 둘러싼 불확실성과, 인플레이션 장기화에 대한 우려로 미 국채 금리가 상승하자 여타 업종을 크게 웃도는 가파른 하락세를 기록했다....",http://www.opinionnews.co.kr/news/articleView.html?idxno=139742,"Tue, 09 Jun 2026 14:28:00 +0900",ok,2026-06-09 14:36:40 KST
news,주식시장,급반등에 증시 '공포지수' 사상최대…금융위기 이후 최고,"VKOSPI는 옵션 가격에 반영된 향후 시장의 기대 변동성을 측정하는 지수로 보통 코스피가 급락할 때 오르는 특성이 있지만, 상승장에서 투자자들이 갖는 불안심리와 주식시장의 불확실성이 클 때도 상승하는 경우가...",http://www.newsfc.co.kr/news/articleView.html?idxno=79149,"Tue, 09 Jun 2026 14:22:00 +0900",ok,2026-06-09 14:36:40 KST
news,주식시장,"'꿈의 배터리' 상용화 앞당긴다… 레몬, 독보적 지지체 기술로 시장 선...","글로벌 전기차 시장의 일시적 수요 정체(캐즘)를 돌파할 핵심 열쇠로 안전성과 에너지 밀도를 획기적으로 높인 차세대 전고체 배터리가 부각되면서, 주식시장에서 2차전지(전고체) 테마가 9일 강력한 폭발세를 연출하고...",https://www.pinpointnews.co.kr/news/articleView.html?idxno=458724,"Tue, 09 Jun 2026 14:14:00 +0900",ok,2026-06-09 14:36:40 KST
news,"""금호타이어"" 주식","통합특별시장 후보 릴레이 인터뷰: ③ 진보당 이종욱 ""민주당 견제 가능...",요즘 많은 분이 주식을 하십니다. 투자를 할 때 가장 중요한 원칙은 '성장 가능성'입니다. 미래가 없거나 곧... 광주지역본부장 -現 금호타이어 광주공장 정상화 시민대책위 공동대표 -現 진보당 광주광역시당 공동위원장...,https://www.namdonews.com/news/articleView.html?idxno=911736,"Tue, 26 May 2026 19:16:00 +0900",ok,2026-06-09 14:36:41 KST
news,"""금호타이어"" 주식","금호타이어 주가, 5월 19일 4,840원 2.42% 하락 마감","이는 업종 평균 대비 금호타이어의 이익 가치가 상대적으로 저평가되어 있음을 나타낸다. 외국인 투자자들의 움직임을 살펴보면, 상장주식수 대비 외국인 보유 주식수의 비율을 나타내는 외국인 소진율은 9....",https://www.joongangenews.com/news/articleView.html?idxno=520403,"Tue, 19 May 2026 17:56:00 +0900",ok,2026-06-09 14:36:41 KST
news,"""금호타이어"" 주식",[더벨]주요 공시(16:00~19:00),"금호타이어, 유상증자 결정 금호타이어는 100% 지분을 보유한 종속회사 Kumho Tire Poland Sp. z o.o.가 약... 해당 종속회사는 폴란드 소재 타이어 제조·판매 법인. 새로 발행되는 주식은 보통주 289만1217주. 1주당...",https://www.thebell.co.kr/free/content/ArticleView.asp?key=202605141844473120106163,"Mon, 18 May 2026 19:08:00 +0900",ok,2026-06-09 14:36:41 KST
news,"""금호타이어"" 주식","금호타이어 주가, 5월 15일 5,060원 1.94% 하락 마감","외국인 투자자들의 금호타이어 주식 소진율은 10.10%로 파악되었다. 한편, 동일 업종의 등락률은 -2.05%를 기록하여 금호타이어의 하락폭과 유사한 흐름을 보였다. 지난 거래일 금호타이어는 5,160원으로 장을...",https://www.joongangenews.com/news/articleView.html?idxno=519698,"Fri, 15 May 2026 17:34:00 +0900",ok,2026-06-09 14:36:41 KST
news,"""금호타이어"" 주식","금호타이어, 매출 증대 위해 해외 공략…獨 더 타이어 쾰른 참가","두마리 토끼를 잡고, 세계적인 타이어 기업으로 도약하겠다""고 말했다. 한편, 금호타이어의 최대 주주가 중국 더블스타의 자회사인 싱웨이코리아 주식회사로, 금호타이어 지분 45%(1억2926만7129주)를 보유하고 있다.",https://www.koreareport.co.kr/news/articleView.html?idxno=50437,"Fri, 15 May 2026 15:06:00 +0900",ok,2026-06-09 14:36:41 KST
news,"""금호타이어"" 073240","금호타이어, 설비구매 협력사 간담회 실시…""ESG 협력 강화""",금호타이어(073240)는 지난 27일 광주 광산구 광주공장 본관에서 '2026년 글로벌 설비구매 협력사 간담회'를 실시했다고 28일 밝혔다. 행사에는 박은태 금호타이어 구매부문 상무를 비롯한 설비 구매 주요 협력사 대표...,https://n.news.naver.com/mnews/article/421/0008970312?sid=103,"Thu, 28 May 2026 09:57:00 +0900",ok,2026-06-09 14:36:41 KST
news,"""금호타이어"" 073240",금호타이어 후원팀 '2026 오네 슈퍼레이스' 최상위 클래스 1·3위,금호타이어(073240)는 후원 모터스포츠팀이 국내 최대 모터스포츠 '2026 오네(O-NE) 슈퍼레이스 챔피언십' 최상위 클래스 3라운드에서 1·3위를 차지했다고 26일 밝혔다. 지난 24일 전남 영암군 코리아인터내셔널서킷(KIC)...,https://n.news.naver.com/mnews/article/421/0008966106?sid=103,"Tue, 26 May 2026 13:00:00 +0900",ok,2026-06-09 14:36:41 KST
news,"""금호타이어"" 073240","유럽 공들이는 금호타이어, 폴란드공장 구축 속도전",금호타이어(073240)가 유럽 내 첫 생산 거점인 폴란드 공장 건설에 속도를 높이기 위해 현지법인에 596억 원을 추가로 출자한다. 금호타이어는 연간 600만 본 규모의 폴란드 공장을 2028년 본격 가동할 계획이다. 17일...,https://n.news.naver.com/mnews/article/011/0004621639?sid=101,"Sun, 17 May 2026 17:43:00 +0900",ok,2026-06-09 14:36:41 KST
news,"""금호타이어"" 073240","금호타이어, 세계 최대 타이어展 'TTC 2026' 참가…'엑스타' 선봬",금호타이어(073240)가 내달 독일에서 열리는 글로벌 타이어 전시회 '더 타이어 쾰른(TTC) 2026'에 참가해 초고성능 타이어 브랜드 '엑스타'(ECSTA)의 기술력을 유럽 시장에 소개한다고 15일 밝혔다. TTC는 독일 쾰른에서...,https://n.news.naver.com/mnews/article/421/0008946766?sid=103,"Fri, 15 May 2026 11:42:00 +0900",ok,2026-06-09 14:36:41 KST
news,"""금호타이어"" 073240","車 주가 부럽네…타이어 3사, 우호적 실적에도 저평가 이어지는 이유",15일 한국거래소에 따르면 한국타이어앤테크놀로지[161390](한국타이어)·금호타이어[073240]·넥센타이어[002350]의 주가는 지난해 말과 비슷한 수준이거나 그보다 낮은 가격에 이날 거래되고 있다. 그나마 한국타이어가...,https://news.einfomax.co.kr/news/articleView.html?idxno=4415030,"Fri, 15 May 2026 10:22:00 +0900",ok,2026-06-09 14:36:41 KST
news,"""금호타이어"" 주가","""실적 좋은데 과도한 저평가""...밸류 매력 커지는 한국타이어","올해 들어 한국타이어를 비롯해 금호타이어, 넥센타이어 등 타이어 업종 주가는 완성차 대비 힘을 못쓰고 있는 게 사실이다. 대표 완성차 기업인 현대차 주가는 지난해 말 29만6500원(종가)에서 전날 63만9000원으로 마감...",http://www.nongaek.com/news/articleView.html?idxno=95640,"Tue, 09 Jun 2026 10:44:00 +0900",ok,2026-06-09 14:36:42 KST
news,"""금호타이어"" 주가","반세기 축적된 가공 기술력…일정실업, 고급 내장재 앞세워 체질 개선 ...","아이윈과 엣지파운드리 역시 미래차 관련 사업 확장 여부가 향후 주가 방향성을 결정할 핵심 변수로... 세방전지, 금호타이어, SJM, 모베이스전자, 성창오토텍, 엠투엔, 유니크 등도 약세 흐름을 이어가고 있다. 단순한 업종...",https://www.pinpointnews.co.kr/news/articleView.html?idxno=457844,"Fri, 05 Jun 2026 13:46:00 +0900",ok,2026-06-09 14:36:42 KST
news,"""금호타이어"" 주가","글로벌 공급망 회복의 숨은 진주… 태양기계, 극단적 저평가 매력 부각","완성차 업종의 주가 부담이 높아진 가운데 차익실현 매물이 출회되고 있으며, 전기차 시장 성장 둔화 우려와... 피에이치에이, 지엠비코리아, 금호타이어, SNT홀딩스, 서연탑메탈, 캐스텍코리아, 유라테크, 태양금속우...",https://www.pinpointnews.co.kr/news/articleView.html?idxno=456841,"Mon, 01 Jun 2026 14:46:00 +0900",ok,2026-06-09 14:36:42 KST
news,"""금호타이어"" 주가","전기차 캐즘 뚫은 핵심 기술력…현대모비스, 글로벌 완성차 러브콜 집중","알루미늄 경량화 부품 수요 확대 기대가 주가를 강하게 밀어올리고 있다. 한주라이트메탈이 글로벌 완성차... 엔브이에이치코리아, 풍강, 금호타이어, 영화테크, 한국피아이엠, 한일단조, 경창산업 등은 전반적으로...",https://www.pinpointnews.co.kr/news/articleView.html?idxno=455655,"Wed, 27 May 2026 14:38:00 +0900",ok,2026-06-09 14:36:42 KST
news,"""금호타이어"" 주가",한주라이트메탈 주가 더 내달린다… 전기차 경량화·알루미늄 부품 공급...,"이 밖에도 우신시스템, 모티브링크, SJM, SY동아, 넥센, 금호타이어 등이 견조한 흐름을 나타내고 있다. 또한 화신, 화승코퍼레이션, 아이에이, 서연이화, 명신산업, 지엠비코리아, 오리엔트정공 등도 동반 상승세를...",https://www.pinpointnews.co.kr/news/articleView.html?idxno=455236,"Tue, 26 May 2026 09:40:00 +0900",ok,2026-06-09 14:36:42 KST
news,"""금호타이어"" 실적",빅데이터와 AI 활용 ‘미래차 타이어’ 선도,"금호타이어가 올해 실적 가이던스로 매출액 5조 1,000억 원 달성을 목표로 순항 중이다. 지난해에는 매출액 4조 7,013억 원, 영업이익 5,755억 원을 기록하며 창사 이래 최대 실적을 달성했다. 금호타이어는 프리미엄 제품...",https://n.news.naver.com/mnews/article/469/0000935371?sid=101,"Tue, 09 Jun 2026 10:49:00 +0900",ok,2026-06-09 14:36:43 KST
news,"""금호타이어"" 실적","""실적 좋은데 과도한 저평가""...밸류 매력 커지는 한국타이어","증권가에선 한국타이어의 주가가 과도하게 저평가된 상황에서 올해 실적 개선이 예상돼 밸류에이션... 올해 들어 한국타이어를 비롯해 금호타이어, 넥센타이어 등 타이어 업종 주가는 완성차 대비 힘을 못쓰고 있는...",http://www.nongaek.com/news/articleView.html?idxno=95640,"Tue, 09 Jun 2026 10:44:00 +0900",ok,2026-06-09 14:36:43 KST
news,"""금호타이어"" 실적","금호타이어, 매출 5조원 시대 여는 ‘글로벌 탑티어’ 도약",창사 이래 최대 실적이라는 눈부신 훈장을 단 금호타이어는 이제 매출 5조원 시대를 목표로 세계 시장을 호령하는 글로벌 탑티어(Top-Tier) 브랜드로 거듭나고 있다. 연구개발에 대한 아낌없는 투자와 철저한 품질 혁신...,http://www.kjdaily.com/article.php?aid=1780915354680064004,"Mon, 08 Jun 2026 19:48:00 +0900",ok,2026-06-09 14:36:43 KST
news,"""금호타이어"" 실적","유럽 관세 폭탄 예고···한국타이어 '독주 채비', 금호·넥센 '우회'",관세 부담에 직면한 금호타이어와 넥센타이어는 중국 생산 물량을 다른 거점으로 분산시키는 공급망 재편을 추진 중이나 하반기 실적 타격은 불가피할 전망이다. 금호타이어는 중국 공장에서 유럽으로 향하던 수출을...,https://www.newsfreezone.co.kr/news/articleView.html?idxno=693467,"Mon, 08 Jun 2026 14:00:00 +0900",ok,2026-06-09 14:36:43 KST
news,"""금호타이어"" 실적","[지방선거, 정책 수혜 (부울경)] 해양·공항·조선·방산 중심으로 돈 흐...","다만 가덕도신공항은 초대형 장기 사업인 만큼 실제 실적 기여 여부는 기본설계, 가격협상, 계약 체결, 착공... 여기에 현대자동차그룹, 현대제철, 한국타이어, 금호타이어 등 자동차·부품·소재 기업군도 친환경차, 수소...",http://www.economytalk.kr/news/articleView.html?idxno=421747,"Sun, 07 Jun 2026 08:00:00 +0900",ok,2026-06-09 14:36:43 KST
news,"""대창솔루션"" 주식",두산에너빌리티·우리기술·오르비텍 동반 강세…코스피·코스닥 매수 ...,대창솔루션 역시 1.42% 오른 1925원에 거래되며 상승 흐름에 동참했다. 시장에서는 원전 관련 기업들이... 주식 및 금융시장 투자는 원금 손실의 위험이 있으며 투자에 따른 모든 책임은 투자자 본인에게 있습니다. 투자...,https://www.cbci.co.kr/news/articleView.html?idxno=580542,"Tue, 09 Jun 2026 09:42:00 +0900",ok,2026-06-09 14:36:43 KST
news,"""대창솔루션"" 주식",두산에너빌리티·비에이치아이·우리기술 흔들렸지만…원전주 조정 속에...,"이밖에 한전기술은 12만5200원으로 3.77%, 일진파워는 3.37%, 우진엔텍은 3.36%, 대창솔루션은 3.49% 각각... 주식 투자에 따른 손실은 투자자 본인의 책임이며, 투자 결정 전 관련 공시와 기업 실적, 시장 상황을 충분히...",https://www.cbci.co.kr/news/articleView.html?idxno=579720,"Fri, 05 Jun 2026 09:28:00 +0900",ok,2026-06-09 14:36:43 KST
news,"""대창솔루션"" 주식","두산에너빌리티·우리기술·대창솔루션 흔들…원전주, 미국·이란 휴전...","우리기술 역시 1만5820원 수준까지 내려오며 6%대 약세를 기록했고, 비에이치아이와 대창솔루션도 동반... 주식 및 원전 관련 테마주는 시장 상황과 국제 정세에 따라 높은 변동성을 나타낼 수 있으며, 투자에 따른 손실은...",https://www.cbci.co.kr/news/articleView.html?idxno=577428,"Wed, 27 May 2026 14:06:00 +0900",ok,2026-06-09 14:36:43 KST
news,"""대창솔루션"" 주식",5월 6일 주식시장 주요공시,"59%) ▶대창솔루션, 2026년1분기 별도기준 매출액 145.37억원(전년동기대비 +107.79%), 영업이익 8.98억원... 2025년 기업가치 제고 계획 이행현황('25년까지 총 주식수의 약 5% 규모 자사주 매입 시행 등)...",https://www.catchnews.kr/news/articleView.html?idxno=123533,"Thu, 07 May 2026 08:44:00 +0900",ok,2026-06-09 14:36:43 KST
news,"""대창솔루션"" 주식","우리기술·두산에너빌리티·오르비텍·대창솔루션, 원전해체주 혼조…수...","반면 오르비텍은 1만1930원으로 0.75% 하락하며 약세를 보였고, 대창솔루션 역시 3055원으로 2.08% 밀리며 하락... [※ 본 기사는 AI의 도움을 받아 작성되었으며, 제공되는 정보는 일반적인 주식 및 금융시장 관련 소식...",https://www.cbci.co.kr/news/articleView.html?idxno=571079,"Wed, 29 Apr 2026 14:02:00 +0900",ok,2026-06-09 14:36:43 KST
news,"""대창솔루션"" 096350",韓-베트남 원전 MOU 소식에 관련주 들썩…두에빌 52주 신고가[특징주],"같은 시각 우진(105840)(10.20%), 오르비텍(046120)(7.31%), 한전기술(052690)(5.54%), 대창솔루션(096350)(4.98%), 우리기술(032820)(4.54%), 비에이치아이(083650)(3.97%), 한전KPS(051600)(3.29%) 등 원전 관련주가 동반 상승 중이다....",https://n.news.naver.com/mnews/article/018/0006264028?sid=101,"Thu, 23 Apr 2026 09:21:00 +0900",ok,2026-06-09 14:36:44 KST
news,"""대창솔루션"" 096350","대창솔루션, 정기주총서 사외이사 2명 신규선임",주강제품 생산 기업 대창솔루션(096350)이 정기주주총회에서 사외이사 재선임과 신규선임 안건 등을 모두 가결했다고 31일 공시했다. 주주총회는 2026년3월31일 열렸다. 안건별로는 제49기 재무제표 및 연결재무제표...,https://www.digitaltoday.co.kr/news/articleView.html?idxno=650751,"Tue, 31 Mar 2026 18:56:00 +0900",ok,2026-06-09 14:36:44 KST
news,"""대창솔루션"" 096350","대창솔루션,이창수 단독 대표 체제로 전환…김대성 대표이사 퇴임","대창솔루션(096350)은 3월 31일 공시를 통해 김대성 대표이사의 임기 만료로 이창수 단독 대표 체제로 변경됐다고 밝혔다. 김대성 대표이사는 임기 만료로 퇴임했으며, 이에 따라 이창수 대표가 단독으로 회사를...",https://www.digitaltoday.co.kr/news/articleView.html?idxno=650737,"Tue, 31 Mar 2026 18:46:00 +0900",ok,2026-06-09 14:36:44 KST
news,"""대창솔루션"" 096350","대창솔루션, 이창수 단독대표 체제로 변경",대창솔루션(096350)은 김대성 대표의 임기만료에 따라 기존 김대성·이창수 공동대표 체제에서 이창수 단독대표 체제로 변경한다고 31일 공시했다.,https://n.news.naver.com/mnews/article/018/0006246460?sid=101,"Tue, 31 Mar 2026 15:02:00 +0900",ok,2026-06-09 14:36:44 KST
news,"""대창솔루션"" 096350","거래소, 광전자·기가레인·우리넷 등 투자유의종목 71건 공시","▷15일간 상승종목 중 소수계좌 매수관여 과다 : HLB이노베이션(024850), 대성하이텍(129920), 대창솔루션(096350), 더코디(224060), 디케이티(290550), 삼일씨엔에스(004440), 세중(039310), 셀레믹스(331920), 쏘닉스...",http://www.newstnt.com/news/articleView.html?idxno=600172,"Wed, 25 Mar 2026 21:36:00 +0900",ok,2026-06-09 14:36:44 KST
