category,query,title,description,link,pubDate,api_state,checked_at,publisher,published_at,news_quality_score,news_quality_reason
news,"""에코플라스틱"" 공시","에코플라스틱, 미국법인에 295억 규모 채무보증 결정",에코플라스틱(038110)은 미국법인인 에코플라스틱 아메리카에 대해 295억원 규모의 채무보증을 결정했다고 30일 공시했다. 채무보증금액은 자기자본대비 8.2%에 해당하는 규모다. 채무보증기간은 오는 5월 10일부터...,https://n.news.naver.com/mnews/article/018/0006270230?sid=101,"Thu, 30 Apr 2026 16:32:00 +0900",ok,2026-06-12 16:33:44 KST,naver,2026-04-30,3,"fresh_45d,important:1"
news,"""에코플라스틱"" 공시",[주식마감] 트럼프 '휴전 연장' 선언에 중동 재건 기대감↑… 대원전선...,"변경됐다고 공시했다. 공시에 따르면 새로운 최대주주인 SUN YANE은 자기자금 30억5900만원을 투입해... 덕산하이메탈, 에코플라스틱, 노브랜드다. 이날 코스피는 전장보다 57.88포인트(0.90%) 오른 6,475.81에 장을...",https://www.ggilbo.com/news/articleView.html?idxno=1154680,"Thu, 23 Apr 2026 19:40:00 +0900",ok,2026-06-12 16:33:44 KST,ggilbo,2026-04-23,0,"old_45d_plus,important:3"
news,"""에코플라스틱"" 공시",[주식마감] '스페이스X' 상장 기대에 미래에셋벤투·아주IB 상한가... '광...,"최근 파이낸셜타임스(FT) 보도에 따르면 스페이스X는 미국 증권거래위원회(SEC)에 '비공개 공시(initial... 세림B&G, 에코플라스틱, 아주IB투자, 파워넷, 카티스, 위지트, 한국첨단소재, 애머릿지, 대신정보통신...",https://www.ggilbo.com/news/articleView.html?idxno=1152732,"Tue, 14 Apr 2026 19:40:00 +0900",ok,2026-06-12 16:33:44 KST,ggilbo,2026-04-14,0,"old_45d_plus,important:3"
news,"""에코플라스틱"" 수주","에이엔피, 자동차 전장화 열풍 타고 PCB·부품 경쟁력 재부각","에스엠벡셀과 인화정공, 티에이치엔, 에코플라스틱, 풍강도 투자심리가 위축된 상태다. 성창오토텍과... 대형 전장주 중심의 수급 쏠림 현상이 심화되면서 중소형 부품주는 실적과 신규 수주 여부에 따라 주가 차별화가...",https://www.pinpointnews.co.kr/news/articleView.html?idxno=456191,"Fri, 29 May 2026 10:08:00 +0900",ok,2026-06-12 16:33:45 KST,pinpointnews,2026-05-29,9,"fresh_14d,important:3"
news,"""에코플라스틱"" 수주","전기차 캐즘 뚫은 핵심 기술력…현대모비스, 글로벌 완성차 러브콜 집중","미국·유럽의 재고 조정이 마무리 국면에 진입했다는 관측과 함께 국내 부품업체들의 수주 모멘텀이... 에코플라스틱, 엠에스오토텍, 삼기, 일지테크, 평화산업 등 중소형 부품주는 변동성이 확대되며 개별 수급에 따라...",https://www.pinpointnews.co.kr/news/articleView.html?idxno=455655,"Wed, 27 May 2026 14:38:00 +0900",ok,2026-06-12 16:33:45 KST,pinpointnews,2026-05-27,3,"fresh_45d,important:1"
news,"""에코플라스틱"" 수주",한주라이트메탈 주가 더 내달린다… 전기차 경량화·알루미늄 부품 공급...,"세방전지, 에코플라스틱 등도 대규모 매수세가 몰리면서 시장 관심을 받고 있다. 아울러 SG&G, 두올, 디에스엠... 실제 수주 증가와 해외 생산 확대 여부를 함께 확인하는 선별적 접근이 중요하다고 말했다.",https://www.pinpointnews.co.kr/news/articleView.html?idxno=455236,"Tue, 26 May 2026 09:40:00 +0900",ok,2026-06-12 16:33:45 KST,pinpointnews,2026-05-26,7,"fresh_45d,important:3"
news,"""에코플라스틱"" 수주","현대차·기아도 반한 모터 기술력… 계양전기, 글로벌 영토 넓힌다","글로벌 수주 증가 기대를 반영하며 상승세를 보이고 있다. 특히 전기차 전환 과정에서 차량당 전장부품 탑재... 일진하이솔루스, 삼기에너지솔루션즈, 삼기, 알멕, 에코플라스틱, HDC현대EP, 유니온머티리얼, GH신소재 등은...",https://www.pinpointnews.co.kr/news/articleView.html?idxno=454322,"Thu, 21 May 2026 09:32:00 +0900",ok,2026-06-12 16:33:45 KST,pinpointnews,2026-05-21,3,"fresh_45d,important:1"
news,"""에코플라스틱"" 수주",외국인 매도 폭탄 맞은 車부품주…그래도 살아남는 종목은 SJG세종 화신...,"다만 일부 종목은 개별 수주 기대감과 실적 개선 전망에 힘입어 상승 흐름을 나타내며 종목별 차별화 장세가... DYP, 에코플라스틱, SNT다이내믹스, 한국큐빅, GH신소재, 지엠비코리아, SJM, 오토앤 등도 매물이 쏟아지면서...",https://www.pinpointnews.co.kr/news/articleView.html?idxno=453370,"Mon, 18 May 2026 09:50:00 +0900",ok,2026-06-12 16:33:45 KST,pinpointnews,2026-05-18,5,"fresh_45d,important:2"
